<?xml version="1.0" encoding="UTF-8" standalone="no"?><todoList xmlns:xsi="http://www.w3.org/2001/XMLSchema-instance" xsi:noNamespaceSchemaLocation="ToDoList.xsd"><simpleTask><description>hahahah</description><deadline>2024-04-27</deadline><priorite>MOYENNE</priorite><estimatedDuration>1</estimatedDuration><progress>50</progress></simpleTask><simpleTask><description>Nettoyer la maison</description><deadline>2024-04-28</deadline><priorite>BASSE</priorite><estimatedDuration>2</estimatedDuration><progress>20</progress></simpleTask><booleanTask><description>Tondre la pelouse</description><deadline>2024-04-29</deadline><priorite>MOYENNE</priorite><estimatedDuration>2</estimatedDuration><isCompleted>false</isCompleted></booleanTask><complexTask><description>Organiser un dîner</description><deadline>2024-05-02</deadline><priorite>HAUTE</priorite><estimatedDuration>2</estimatedDuration><progress>20</progress><subTasks><simpleTask><description>Préparer le dîner</description><deadline>2024-05-02</deadline><priorite>BASSE</priorite><estimatedDuration>1</estimatedDuration><progress>30</progress></simpleTask><simpleTask><description>Servir le dîner</description><deadline>2024-04-29</deadline><priorite>HAUTE</priorite><estimatedDuration>1</estimatedDuration><progress>10</progress></simpleTask></subTasks></complexTask></todoList>