<?xml version="1.0" encoding="UTF-8"?>
<todoList xmlns:xsi="http://www.w3.org/2001/XMLSchema-instance" xsi:noNamespaceSchemaLocation="ToDoList.xsd">
 <simpleTask>
    <description>Simple Task 1</description>
    <deadline>2023-03-01</deadline>
    <priorite>HAUTE</priorite>
    <estimatedDuration>5</estimatedDuration>
    <progress>2</progress>
  </simpleTask>
  <booleanTask>
    <description>Boolean Task 1</description>
    <deadline>2023-03-02</deadline>
    <priorite>MOYENNE</priorite>
    <estimatedDuration>10</estimatedDuration>
    <isCompleted>true</isCompleted>
  </booleanTask>
  <complexTask>
    <description>Complex Task 1</description>
    <deadline>2023-03-03</deadline>
    <priorite>BASSE</priorite>
    <subTasks>
      <simpleTask>
        <description>Sub Task 1.1</description>
        <deadline>2023-03-04</deadline>
        <priorite>HAUTE</priorite>
        <estimatedDuration>3</estimatedDuration>
        <progress>1</progress>
      </simpleTask>
      <booleanTask>
        <description>Sub Task 1.2</description>
        <deadline>2023-03-05</deadline>
        <priorite>MOYENNE</priorite>
        <estimatedDuration>2</estimatedDuration>
        <isCompleted>false</isCompleted>
      </booleanTask>
    </subTasks>
    <progress>4</progress>
    <estimatedDuration>10</estimatedDuration>
  </complexTask>
</todoList>
